{
  "id": "designer.panel.pages.open",
  "symbol": "openPagesPanel",
  "intent": "Open the Pages panel when it is not already visible.",
  "selectionStatus": "include",
  "reasonCodes": ["stable-selector-evidence"],
  "capabilities": ["panel-management", "page-navigation"],
  "contexts": ["designer-ready", "main-document"],
  "parameters": [],
  "document": "main",
  "selectors": [
    {"key": "Sidebar.PAGES_BUTTON", "strategy": "data-automation-id", "selector": "left-sidebar-pages-button"},
    {"key": "Panels.PAGES", "strategy": "data-automation-id", "selector": "pages"}
  ],
  "actions": [
    {"verb": "click-if-hidden", "target": "Sidebar.PAGES_BUTTON"},
    {"verb": "wait-visible", "target": "Panels.PAGES"}
  ],
  "postconditions": ["Panels.PAGES is visible"],
  "guardrails": ["Do not click the panel button when the panel is already visible."],
  "scores": {"confidence": 90, "utility": 70, "novelty": 60},
  "provenance": {"sourceCommit": "fixture"},
  "evidence": [],
  "holdoutEvidence": [],
  "negativeEvidence": []
}
